<SoloTokenConfig
        xmlns:xsi="http://www.w3.org/2001/XMLSchema-instance"
        xsi:noNamespaceSchemaLocation="SoloTokenConfig.xsd">

    <!--TOKEN-->
    <DiscardToken>
        <Color>GREEN</Color>
        <NumCards>2</NumCards>
    </DiscardToken>

    <!--TOKEN-->
    <DiscardToken>
        <Color>YELLOW</Color>
        <NumCards>2</NumCards>
    </DiscardToken>

    <!--TOKEN-->
    <DiscardToken>
        <Color>PURPLE</Color>
        <NumCards>2</NumCards>
    </DiscardToken>

    <!--TOKEN-->
    <DiscardToken>
        <Color>BLUE</Color>
        <NumCards>2</NumCards>
    </DiscardToken>

    <!--TOKEN-->
    <FaithPointToken>
        <NumPoints>2</NumPoints>
        <Shuffle>false</Shuffle>
    </FaithPointToken>

    <!--TOKEN-->
    <FaithPointToken>
        <NumPoints>1</NumPoints>
        <Shuffle>true</Shuffle>
    </FaithPointToken>
</SoloTokenConfig>